sample_id,original_id,content,labels,implied_statement,rationale,reviewer1_relevance,reviewer1_faithfulness,reviewer1_completeness,reviewer2_relevance,reviewer2_faithfulness,reviewer2_completeness,notes
41,9612,"Trang Bùi mi là trùm ỉa dạo đó Bùi, ghi nhớ dùm","individuals#hate, groups#offensive",người gây phiền toái,"Việc dùng từ ""trùm ỉa dạo"" mang tính hạ thấp và châm biếm, nhằm biểu lộ sự khinh miệt đối với cá nhân. | Cách xưng hô thân mật như ""Trang Bùi mi"" thể hiện sự không tôn trọng đối với người được nhắm đến. | Câu ""ghỉ nhớ dùm"" củng cố ý định truyền tải sự hạ bệ và châm biếm thái độ tiêu cực. | Tổng thể, lời nói nhằm mục đích gán cho đối tượng danh xưng tiêu cực ""người gây phiền toái"" theo ngụ ý.",,,,,,,
42,3995,"Đm cái mỏ như mỏ vịt thề lề, thè lè, thấy ghê jk nào dừa chắc ooke",individuals#hate,ngoại hình xấu xí,"Sử dụng từ “Đm” cùng cụm từ so sánh “mỏ như mỏ vịt” nhằm gây xúc phạm mạnh. | Các từ như “thề lề, thè lè” được dùng để chế nhạo dáng vẻ và ngoại hình của người khác. | Lời nói đồ sộ mang tính hạ thấp và khinh miệt đối với ngoại hình của mục tiêu. | Ngôn từ thô tục và miệt thị này phù hợp với nhãn hate do có tính chất lăng mạ trực tiếp.",,,,,,,
43,4284,Noi. Cho. Nhieu di.  Chu.  Mai. Mot. Gia. Nam ia day. 1 cho.  Luc. Do. Muon. Noi. Cg. K noi. Dc.    Hi,individuals#offensive,tuổi già bất lực,"Cách viết rời rạc và thiếu mạch lạc nhằm tạo ra hiệu ứng mỉa mai, chỉ trích đối tượng. | Những từ ngữ như ""Mot Gia Nam ia day"" được đọc như sự chế giễu, gợi ý về sự bất lực của người lớn tuổi. | Cách chia cách từ làm tăng hiệu ứng châm biếm, ngầm ám chỉ tuổi già không còn năng lực. | Ngôn từ được sử dụng mang tính chất xúc phạm nhẹ, phù hợp với nhãn ""offensive"".",,,,,,,
44,3567,Ngộ l ghê ta ơi,"individuals#offensive, groups#offensive",điều này là vô lý,"Cụm từ ""Ngộ l ghê ta ơi"" được sử dụng với giọng điệu hoài nghi và chế giễu. | Việc rút gọn từ ""Ngộ l"" cho thấy sự mỉa mai đối với hành động hoặc suy nghĩ của đối tượng. | Cách diễn đạt này thể hiện thái độ khinh thường thông qua lời nói ngắn gọn. | Nội dung mang tính châm biếm rằng hành vi của đối tượng là vô lý, phù hợp với mức offensive.",,,,,,,
45,5281,"Cô ba chở vàng qua mỹ :)) nghe hư cấu vl,mày vào xem ký sự 30/4 đi nhé",individuals#hate,tấn công mỉa mai lịch sử sai lệch,"Câu nói 'Cô ba chở vàng qua mỹ' chế nhạo một sự kiện lịch sử theo cách mỉa mai. | Việc thêm 'nghe hư cấu vl' cho thấy sự hoài nghi và khinh miệt đối với sự thật lịch sử. | Lời nói vừa chế giễu vừa phỉ báng nhằm giảm giá trị của câu chuyện lịch sử. | Ngôn từ được lựa chọn để tấn công cá nhân thông qua sự bóp méo thông tin, thể hiện rõ tính hate.",,,,,,,
46,2247,"Có tí tiền hống hách , bgio biết quá muộn rồi , cc tốt nhất im cmnm vào , chấp hành tốt , dù ông có tốt đến mấy cdm có chửi ông sống ko bằng chết .",individuals#hate,người có tiền là kẻ hống hách,"Câu nói đề cập đến 'tiền hống hách' nhằm chỉ trích thái độ của người có tiền. | Việc sử dụng từ ngữ tục tĩu như 'cc', 'cmnm', 'cdm' làm tăng mức độ xúc phạm. | Lời nói mang tính chế giễu và phán xét gay gắt đối với người có địa vị tài chính. | Ngôn ngữ được dùng nhằm mục đích hạ thấp phẩm giá của đối tượng, phù hợp với hate speech.",,,,,,,
47,3771,Từ bi mà chửi đụ má đụ mẹ,"individuals#offensive, religion#offensive",người từ bi giả dối,"Cách kết hợp giữa ""Từ bi"" và cụm từ chửi tục tạo ra sự mâu thuẫn nhằm chế giễu giá trị đạo đức. | Ngôn từ gây sốc nhằm làm nhấn mạnh tính giả dối của người thể hiện ""từ bi"". | Việc sử dụng lời nói thô tục để đối chiếu với hình ảnh đạo đức tạo ra sự phản cảm rõ rệt. | Nhãn offensive về cá nhân và tôn giáo cho thấy mục đích hạ thấp uy tín về đạo đức.",,,,,,,
48,2187,Chưa viết thành Mê Cung là khá rồi. Mà cái thằng soạn thư này chắc cũng không biết Mê Công là cái thứ gì. Thằng ký thì cứ ký!,individuals#offensive,người có quyền là vô trách nhiệm,"Sử dụng từ 'thằng' để hạ thấp giá trị của người soạn thư, mang tính cá nhân. | Cách nói cho thấy sự khinh miệt đối với người có quyền, mặc dù chỉ là châm biếm. | Phản ánh thái độ cho rằng người quyền lực không quan tâm đến chất lượng công việc. | Giọng điệu châm biếm và xúc phạm phù hợp với mức 'offensive'.",,,,,,,
49,865,"NHNN lại có việc , thằng Son đổi USD số lượng lớn ra tiền Việt kìa . Dân đổi 100USD thì nó đè ra phạt 90tr , thằng cán bộ đổi mấy triệu USD có khi xe chở tiền nó lùi vào tận cửa phòng khách ... Pháp luật phân biệt đối xử vcl",politics#hate,pháp luật phân biệt đối xử,Bài viết sử dụng từ ngữ khiếm nhã như 'thằng Son' và 'thằng cán bộ' để hạ thấp đối tượng. | So sánh mức phạt giữa dân thường và cán bộ nhằm làm nổi bật bất công của pháp luật. | Việc sử dụng các chi tiết cụ thể và miêu tả mâu thuẫn làm tăng tính kích động. | Ngôn từ gây chia rẽ và phỉ báng thuộc mức 'hate' khi công kích hệ thống chính trị và pháp lý.,,,,,,,
50,1311,Đĩ già khùng,individuals#hate,phụ nữ già là điếm điên,"Cách dùng từ “Đĩ già khùng” là sự kết hợp của hai lời lẽ xúc phạm về tình dục và trí tuệ. | Từ ngữ mang tính định kiến và phân biệt đối xử với phụ nữ lớn tuổi. | Phản ánh định kiến về nữ giới, hạ thấp phẩm giá của đối tượng. | Đáp ứng tiêu chí hate khi sử dụng ngôn từ chê bai và xúc phạm trực tiếp.",,,,,,,
